Unnamed: 0,ProductID,Name,CategoryID,Price,Description,StockLevel,SupplierID
155,4462,Gaming Consoles & Accessories - whiteboard 24/365 e-tailers,5,1294.08,Color enter either task. Specifically designed for gaming consoles & accessories.,129,20
156,1308,Drones & Tech Toys - brand collaborative niches,8,193.92,Resource building dog natural probably decade fear. Specifically designed for drones & tech toys.,362,13
157,9832,TVs & Monitors - unleash bricks-and-clicks networks,4,1020.06,Avoid particularly leg several region travel. Specifically designed for tvs & monitors.,369,61
158,4455,Smartphones & Accessories - reinvent collaborative applications,1,771.96,It health push school nothing which. Specifically designed for smartphones & accessories.,31,74
159,7022,Gaming Consoles & Accessories - seize mission-critical channels,5,846.92,Congress general himself despite. Specifically designed for gaming consoles & accessories.,128,7
160,8456,Gaming Consoles & Accessories - architect efficient niches,5,537.95,Recognize happen above challenge like big even. Specifically designed for gaming consoles & accessories.,14,9
161,2206,Drones & Tech Toys - incentivize strategic deliverables,8,1483.74,Fall security three little sell. Specifically designed for drones & tech toys.,348,84
162,5382,Computers & Laptops - scale holistic users,2,993.32,Present and interview city performance sound defense. Specifically designed for computers & laptops.,58,37
163,158,TVs & Monitors - orchestrate scalable info-mediaries,4,1018.56,Than suggest without part receive director win. Specifically designed for tvs & monitors.,290,68
164,6892,Computers & Laptops - transform dynamic functionalities,2,1370.66,Speech send my late require. Specifically designed for computers & laptops.,134,30
165,6290,Gaming Consoles & Accessories - synthesize transparent portals,5,210.04,Threat hot idea. Specifically designed for gaming consoles & accessories.,72,97
166,5188,Smartphones & Accessories - transform wireless networks,1,889.98,Friend country choice down rate. Specifically designed for smartphones & accessories.,309,83
167,8101,Smartphones & Accessories - streamline holistic infrastructures,1,1148.2,Carry nearly per Mr toward loss. Specifically designed for smartphones & accessories.,379,95
168,5141,Gaming Consoles & Accessories - transition real-time info-mediaries,5,847.68,Activity increase outside religious. Specifically designed for gaming consoles & accessories.,194,48
169,4270,Computers & Laptops - leverage vertical metrics,2,1471.99,Example ground available respond common work interesting. Specifically designed for computers & laptops.,167,2
170,8938,Drones & Tech Toys - deliver compelling mindshare,8,363.71,Note could service ground organization fish look. Specifically designed for drones & tech toys.,15,61
171,1958,Gaming Consoles & Accessories - leverage granular vortals,5,411.77,Various city she tree wife. Specifically designed for gaming consoles & accessories.,436,18
172,1819,Smartphones & Accessories - re-contextualize open-source e-tailers,1,627.02,Bag direction size become material. Specifically designed for smartphones & accessories.,245,18
173,8559,TVs & Monitors - utilize plug-and-play e-business,4,356.76,Suffer available fall interview Congress. Specifically designed for tvs & monitors.,443,12
174,9536,Smartphones & Accessories - iterate bricks-and-clicks interfaces,1,1208.91,Story address center Democrat. Specifically designed for smartphones & accessories.,146,64
175,7635,TVs & Monitors - generate rich bandwidth,4,678.72,Simply white serve save hit. Specifically designed for tvs & monitors.,27,80
176,3144,Gaming Consoles & Accessories - empower transparent web services,5,876.59,Skin window ten may include. Specifically designed for gaming consoles & accessories.,66,29
177,7177,TVs & Monitors - grow virtual bandwidth,4,883.85,Model star need national meeting. Specifically designed for tvs & monitors.,297,64
178,4755,TVs & Monitors - reinvent cross-platform models,4,220.96,Difference drop provide. Specifically designed for tvs & monitors.,364,10
179,5099,Drones & Tech Toys - embrace B2C models,8,320.43,Real world get hotel old. Specifically designed for drones & tech toys.,473,28
180,5274,TVs & Monitors - strategize front-end models,4,528.05,Like wait language event visit impact. Specifically designed for tvs & monitors.,177,5
181,4592,Smartphones & Accessories - visualize real-time supply-chains,1,1198.67,Structure tonight always benefit model. Specifically designed for smartphones & accessories.,94,58
182,9410,Smartphones & Accessories - aggregate leading-edge experiences,1,594.08,Take whether trial the above Mrs find develop. Specifically designed for smartphones & accessories.,156,21
183,2107,Gaming Consoles & Accessories - enhance customized bandwidth,5,854.64,Already point threat plan tell present lay. Specifically designed for gaming consoles & accessories.,139,77
184,6001,Drones & Tech Toys - repurpose value-added technologies,8,1150.41,Service there time industry. Specifically designed for drones & tech toys.,48,27
185,6149,Wearable Technology - redefine cutting-edge e-business,7,1189.75,Lay call laugh four. Specifically designed for wearable technology.,223,57
186,9120,TVs & Monitors - incentivize out-of-the-box technologies,4,1483.46,Add billion friend reveal area whatever front. Specifically designed for tvs & monitors.,428,94
187,8121,TVs & Monitors - cultivate bleeding-edge paradigms,4,330.78,Leave get board capital executive space ago. Specifically designed for tvs & monitors.,392,5
188,9677,Gaming Consoles & Accessories - repurpose 24/7 e-commerce,5,845.49,Alone fund become international information ok inside. Specifically designed for gaming consoles & accessories.,460,41
189,5619,Wearable Technology - grow front-end networks,7,1312.08,Myself cold bar yourself. Specifically designed for wearable technology.,104,74
190,2323,Computers & Laptops - synthesize B2B communities,2,163.41,Whatever they middle law young staff but. Specifically designed for computers & laptops.,85,100
191,1530,Gaming Consoles & Accessories - streamline turn-key portals,5,1056.51,Miss energy create well energy. Specifically designed for gaming consoles & accessories.,422,2
192,1073,Smartphones & Accessories - productize holistic platforms,1,1184.89,Fill single story note political. Specifically designed for smartphones & accessories.,352,5
193,1566,Computers & Laptops - unleash interactive e-tailers,2,591.2,Nor buy coach that mouth. Specifically designed for computers & laptops.,90,7
194,9502,Smartphones & Accessories - repurpose robust action-items,1,57.03,Also wonder deal theory. Specifically designed for smartphones & accessories.,378,90
195,3401,Smartphones & Accessories - transition seamless vortals,1,211.19,Various suggest life candidate close may. Specifically designed for smartphones & accessories.,484,23
196,1799,Gaming Consoles & Accessories - optimize 24/365 applications,5,1367.5,Talk make listen office pay. Specifically designed for gaming consoles & accessories.,302,12
197,5806,TVs & Monitors - whiteboard global web services,4,1451.93,Practice artist coach southern young writer. Specifically designed for tvs & monitors.,357,41
198,835,Computers & Laptops - visualize viral technologies,2,895.44,Someone pay strategy opportunity development activity. Specifically designed for computers & laptops.,379,99
199,5564,Smartphones & Accessories - expedite robust partnerships,1,837.22,Share suggest rock majority pass which prove. Specifically designed for smartphones & accessories.,293,30
